{
  "api_version": "metactl/v2alpha1",
  "summary": "Reviewer role resolved to Claude Code with two trusted packs. An external network-oriented candidate pack was suppressed by policy.",
  "what_is_active": [
    "role:reviewer",
    "pack:repo-review-instructions@1.0.0",
    "pack:unit-test-loop@1.0.0",
    "policy:safe-review@1.0.0",
    "target:claude-code@2026.03.25"
  ],
  "why_it_is_active": [
    {
      "subject_ref": {
        "kind": "pack",
        "id": "repo-review-instructions",
        "version": "1.0.0"
      },
      "reason": "Role reviewer defaults include this pack."
    },
    {
      "subject_ref": {
        "kind": "pack",
        "id": "unit-test-loop",
        "version": "1.0.0"
      },
      "reason": "Configured pack matched task tags for flaky tests and verification."
    }
  ],
  "what_was_suppressed": [
    {
      "subject_ref": {
        "kind": "pack",
        "id": "dangerous-network-scraper",
        "version": "0.1.0"
      },
      "reason_code": "suppressed_by_policy",
      "detail": "External unreviewed packs are denied in curated_only discovery mode."
    }
  ],
  "unknown_or_unsupported": [],
  "resolve_graph": {
    "api_version": "metactl/v2alpha1",
    "source_config_digest": "sha256:11111111111111111111111111111111",
    "overlay_digest": "sha256:22222222222222222222222222222222",
    "role": {
      "kind": "role",
      "id": "reviewer",
      "version": "1.0.0"
    },
    "selected_target": {
      "kind": "target",
      "id": "claude-code",
      "version": "2026.03.25"
    },
    "requested_pack_refs": [
      {
        "kind": "pack",
        "id": "repo-review-instructions",
        "version": "1.0.0"
      },
      {
        "kind": "pack",
        "id": "unit-test-loop",
        "version": "1.0.0"
      },
      {
        "kind": "pack",
        "id": "dangerous-network-scraper",
        "version": "0.1.0"
      }
    ],
    "activated_pack_refs": [
      {
        "kind": "pack",
        "id": "repo-review-instructions",
        "version": "1.0.0"
      },
      {
        "kind": "pack",
        "id": "unit-test-loop",
        "version": "1.0.0"
      }
    ],
    "suppressed_packs": [
      {
        "pack_ref": {
          "kind": "pack",
          "id": "dangerous-network-scraper",
          "version": "0.1.0"
        },
        "reason_code": "suppressed_by_policy",
        "detail": "Denied by safe-review policy because trust tier is external_unreviewed."
      }
    ],
    "applied_policies": [
      {
        "kind": "policy",
        "id": "safe-review",
        "version": "1.0.0"
      }
    ],
    "capability_gaps": [],
    "provenance_refs": [
      "artifact:repo-review-instructions-provenance",
      "artifact:unit-test-loop-provenance"
    ],
    "brownfield_mode": "shadow_compile"
  }
}
